{
 "packet_version": "2.0.0",
 "packet_date": "2026-08-22",
 "rubric_version": "1.0",
 "run_notes": "DRY RUN \u2014 identity baseline only. No card is approved for publication.",
 "set_groups": [
  {
   "group_key": "2025|Topps Stadium Club|Baseball",
   "card_count": 15,
   "value_per_card_low": 0.75,
   "value_per_card_mid": 1.1,
   "value_per_card_high": 2.25,
   "basis": "set_level",
   "note": "Base commons; no individual card market",
   "updated_at": "2026-08-22"
  }
 ],
 "site_corrections": [
  {
   "card_uid": "MECV-0012",
   "field": "title",
   "from": "Damien priest 1989 superstar auto /5",
   "to": "2026 Topps Chrome WWE Damian Priest 1986 Topps Superstar Auto #86T-DP /5",
   "approved": true,
   "reason": "Subject misspelled; set year is 1986 per the 2026-08-15 comp review."
  }
 ],
 "external_manual_actions": [
  {
   "card_uid": "MECV-0012",
   "system": "ebay",
   "action": "Correct the live listing title to match the canonical identity",
   "current_value": "Damien priest 1989 superstar auto /5",
   "target_value": "2026 Topps Chrome WWE Damian Priest 1986 Topps Superstar Auto #86T-DP /5",
   "priority": "high",
   "reason": "Misspelling and wrong year are suppressing search views on a $199 listing."
  }
 ],
 "cards": [
  {
   "card_uid": "MECV-0001",
   "ebay_item_id": null,
   "tier": "T1",
   "refreshed": false,
   "updated_at": "2026-08-22",
   "vault_value_low": null,
   "vault_value_mid": null,
   "vault_value_high": null,
   "market_position": "insufficient_evidence",
   "market_health": null,
   "upside_potential": null,
   "main_event_rating": null,
   "confidence": null,
   "confidence_label": "insufficient_evidence",
   "publish_ready": false,
   "publication_status": "research_in_progress",
   "publish_reason": "First-run identity baseline; no research performed yet.",
   "needs_human_review": false,
   "drivers": [],
   "risks": []
  },
  {
   "card_uid": "MECV-0002",
   "ebay_item_id": null,
   "tier": "T1",
   "refreshed": false,
   "updated_at": "2026-08-22",
   "vault_value_low": null,
   "vault_value_mid": null,
   "vault_value_high": null,
   "market_position": "insufficient_evidence",
   "market_health": null,
   "upside_potential": null,
   "main_event_rating": null,
   "confidence": null,
   "confidence_label": "insufficient_evidence",
   "publish_ready": false,
   "publication_status": "research_in_progress",
   "publish_reason": "First-run identity baseline; no research performed yet.",
   "needs_human_review": false,
   "drivers": [],
   "risks": []
  },
  {
   "card_uid": "MECV-0003",
   "ebay_item_id": "318638286490",
   "tier": "T1",
   "refreshed": false,
   "updated_at": "2026-08-22",
   "vault_value_low": null,
   "vault_value_mid": null,
   "vault_value_high": null,
   "market_position": "insufficient_evidence",
   "market_health": null,
   "upside_potential": null,
   "main_event_rating": null,
   "confidence": null,
   "confidence_label": "insufficient_evidence",
   "publish_ready": false,
   "publication_status": "research_in_progress",
   "publish_reason": "First-run identity baseline; no research performed yet.",
   "needs_human_review": false,
   "drivers": [],
   "risks": []
  },
  {
   "card_uid": "MECV-0004",
   "ebay_item_id": null,
   "tier": "T1",
   "refreshed": false,
   "updated_at": "2026-08-22",
   "vault_value_low": null,
   "vault_value_mid": null,
   "vault_value_high": null,
   "market_position": "insufficient_evidence",
   "market_health": null,
   "upside_potential": null,
   "main_event_rating": null,
   "confidence": null,
   "confidence_label": "insufficient_evidence",
   "publish_ready": false,
   "publication_status": "research_in_progress",
   "publish_reason": "First-run identity baseline; no research performed yet.",
   "needs_human_review": false,
   "drivers": [],
   "risks": []
  },
  {
   "card_uid": "MECV-0005",
   "ebay_item_id": "318731377972",
   "tier": "T1",
   "refreshed": false,
   "updated_at": "2026-08-22",
   "vault_value_low": null,
   "vault_value_mid": null,
   "vault_value_high": null,
   "market_position": "insufficient_evidence",
   "market_health": null,
   "upside_potential": null,
   "main_event_rating": null,
   "confidence": null,
   "confidence_label": "insufficient_evidence",
   "publish_ready": false,
   "publication_status": "research_in_progress",
   "publish_reason": "First-run identity baseline; no research performed yet.",
   "needs_human_review": false,
   "drivers": [],
   "risks": []
  },
  {
   "card_uid": "MECV-0006",
   "ebay_item_id": "318731525182",
   "tier": "T1",
   "refreshed": false,
   "updated_at": "2026-08-22",
   "vault_value_low": null,
   "vault_value_mid": null,
   "vault_value_high": null,
   "market_position": "insufficient_evidence",
   "market_health": null,
   "upside_potential": null,
   "main_event_rating": null,
   "confidence": null,
   "confidence_label": "insufficient_evidence",
   "publish_ready": false,
   "publication_status": "research_in_progress",
   "publish_reason": "First-run identity baseline; no research performed yet.",
   "needs_human_review": false,
   "drivers": [],
   "risks": []
  },
  {
   "card_uid": "MECV-0007",
   "ebay_item_id": "318731522341",
   "tier": "T1",
   "refreshed": false,
   "updated_at": "2026-08-22",
   "vault_value_low": null,
   "vault_value_mid": null,
   "vault_value_high": null,
   "market_position": "insufficient_evidence",
   "market_health": null,
   "upside_potential": null,
   "main_event_rating": null,
   "confidence": null,
   "confidence_label": "insufficient_evidence",
   "publish_ready": false,
   "publication_status": "research_in_progress",
   "publish_reason": "First-run identity baseline; no research performed yet.",
   "needs_human_review": false,
   "drivers": [],
   "risks": []
  },
  {
   "card_uid": "MECV-0008",
   "ebay_item_id": "318731374308",
   "tier": "T1",
   "refreshed": false,
   "updated_at": "2026-08-22",
   "vault_value_low": null,
   "vault_value_mid": null,
   "vault_value_high": null,
   "market_position": "insufficient_evidence",
   "market_health": null,
   "upside_potential": null,
   "main_event_rating": null,
   "confidence": null,
   "confidence_label": "insufficient_evidence",
   "publish_ready": false,
   "publication_status": "research_in_progress",
   "publish_reason": "First-run identity baseline; no research performed yet.",
   "needs_human_review": false,
   "drivers": [],
   "risks": []
  },
  {
   "card_uid": "MECV-0009",
   "ebay_item_id": "318731377273",
   "tier": "T1",
   "refreshed": false,
   "updated_at": "2026-08-22",
   "vault_value_low": null,
   "vault_value_mid": null,
   "vault_value_high": null,
   "market_position": "insufficient_evidence",
   "market_health": null,
   "upside_potential": null,
   "main_event_rating": null,
   "confidence": null,
   "confidence_label": "insufficient_evidence",
   "publish_ready": false,
   "publication_status": "research_in_progress",
   "publish_reason": "First-run identity baseline; no research performed yet.",
   "needs_human_review": false,
   "drivers": [],
   "risks": []
  },
  {
   "card_uid": "MECV-0010",
   "ebay_item_id": null,
   "tier": "T1",
   "refreshed": false,
   "updated_at": "2026-08-22",
   "vault_value_low": null,
   "vault_value_mid": null,
   "vault_value_high": null,
   "market_position": "insufficient_evidence",
   "market_health": null,
   "upside_potential": null,
   "main_event_rating": null,
   "confidence": null,
   "confidence_label": "insufficient_evidence",
   "publish_ready": false,
   "publication_status": "research_in_progress",
   "publish_reason": "First-run identity baseline; no research performed yet.",
   "needs_human_review": false,
   "drivers": [],
   "risks": []
  },
  {
   "card_uid": "MECV-0011",
   "ebay_item_id": "318731097217",
   "tier": "T1",
   "refreshed": false,
   "updated_at": "2026-08-22",
   "vault_value_low": null,
   "vault_value_mid": null,
   "vault_value_high": null,
   "market_position": "insufficient_evidence",
   "market_health": null,
   "upside_potential": null,
   "main_event_rating": null,
   "confidence": null,
   "confidence_label": "insufficient_evidence",
   "publish_ready": false,
   "publication_status": "research_in_progress",
   "publish_reason": "First-run identity baseline; no research performed yet.",
   "needs_human_review": false,
   "drivers": [],
   "risks": []
  },
  {
   "card_uid": "MECV-0012",
   "ebay_item_id": "318703899081",
   "tier": "T1",
   "refreshed": false,
   "updated_at": "2026-08-22",
   "vault_value_low": null,
   "vault_value_mid": null,
   "vault_value_high": null,
   "market_position": "insufficient_evidence",
   "market_health": null,
   "upside_potential": null,
   "main_event_rating": null,
   "confidence": null,
   "confidence_label": "insufficient_evidence",
   "publish_ready": false,
   "publication_status": "research_in_progress",
   "publish_reason": "First-run identity baseline; no research performed yet.",
   "needs_human_review": false,
   "drivers": [],
   "risks": []
  },
  {
   "card_uid": "MECV-0013",
   "ebay_item_id": "318731527044",
   "tier": "T1",
   "refreshed": false,
   "updated_at": "2026-08-22",
   "vault_value_low": null,
   "vault_value_mid": null,
   "vault_value_high": null,
   "market_position": "insufficient_evidence",
   "market_health": null,
   "upside_potential": null,
   "main_event_rating": null,
   "confidence": null,
   "confidence_label": "insufficient_evidence",
   "publish_ready": false,
   "publication_status": "research_in_progress",
   "publish_reason": "First-run identity baseline; no research performed yet.",
   "needs_human_review": false,
   "drivers": [],
   "risks": []
  },
  {
   "card_uid": "MECV-0014",
   "ebay_item_id": "318731119307",
   "tier": "T1",
   "refreshed": false,
   "updated_at": "2026-08-22",
   "vault_value_low": null,
   "vault_value_mid": null,
   "vault_value_high": null,
   "market_position": "insufficient_evidence",
   "market_health": null,